{
  "$schema": "../../../catalog/schemas/account-state.schema.json",
  "persona": "emma",
  "uid": "IRUp7V2A7WWbXqJlrfTju8NuGHK2",
  "env": "prod",
  "updatedAt": "2026-10-15T21:00:00Z",
  "updatedBy": "app-footage capture agent (Claude), 2026-10-15: +1 roll photo (navy cap packshot) for the Find-more and Add-item footage; Add item of it ended in the duplicate review keeping her existing cap, so the wardrobe is unchanged at 49",
  "wardrobe": [
    {
      "libraryId": "garment.emma.blazer-black.v1",
      "photoId": "photo.emma.r01-coffee-shop.v1",
      "appItemIds": [
        "66c528596e6dff4f79e8240d"
      ],
      "appNames": [
        "Black Blazer"
      ],
      "via": "gallery-scan",
      "status": "synced",
      "at": "2026-10-15T18:31:20Z",
      "note": "Found by the in-app photo scan (import 6ad11aeae5cae85798172dd5) in photo.emma.r01-coffee-shop.v1; library garment file assets/garments/black-blazer-v1.jpg. App sourcePhotoId is the import's own photo id; photoId here is the camera-roll photo it came from."
    },
    {
      "libraryId": "garment.emma.tee-white.v1",
      "photoId": "photo.emma.r01-coffee-shop.v1",
      "appItemIds": [
        "72f975c9ed99403b5f330a9e"
      ],
      "appNames": [
        "White T-shirt"
      ],
      "via": "gallery-scan",
      "status": "synced",
      "at": "2026-10-15T18:31:20Z",
      "note": "Found by the in-app photo scan (import 6ad11aeae5cae85798172dd5) in photo.emma.r01-coffee-shop.v1; library garment file assets/garments/white-tee-v2.jpg. App sourcePhotoId is the import's own photo id; photoId here is the camera-roll photo it came from."
    },
    {
      "libraryId": "garment.emma.jeans-straight-light-wash.v1",
      "photoId": "photo.emma.r19-fall-game-day.v1",
      "appItemIds": [
        "f07b2378a31f77456736a1a4"
      ],
      "appNames": [
        "Blue Jeans"
      ],
      "via": "gallery-scan",
      "status": "synced",
      "at": "2026-10-15T18:31:20Z",
      "note": "Found by the in-app photo scan (import 6ad11aeae5cae85798172dd5) in photo.emma.r19-fall-game-day.v1; library garment file assets/garments/light-wash-straight-jeans-v1.jpg. App sourcePhotoId is the import's own photo id; photoId here is the camera-roll photo it came from."
    },
    {
      "libraryId": "garment.emma.coat-trench-khaki.v1",
      "photoId": "photo.emma.r02-subway-platform.v1",
      "appItemIds": [
        "c11575fc314edd10ed18b461"
      ],
      "appNames": [
        "Beige Trench Coat"
      ],
      "via": "gallery-scan",
      "status": "synced",
      "at": "2026-10-15T18:31:20Z",
      "note": "Found by the in-app photo scan (import 6ad11aeae5cae85798172dd5) in photo.emma.r02-subway-platform.v1; library garment file assets/garments/khaki-trench-coat-v1.jpg. App sourcePhotoId is the import's own photo id; photoId here is the camera-roll photo it came from."
    },
    {
      "libraryId": "garment.emma.trousers-black.v1",
      "photoId": "photo.emma.r05-office.v1",
      "appItemIds": [
        "639cb4cbd53fb05eb501cd1f"
      ],
      "appNames": [
        "Black Trousers"
      ],
      "via": "gallery-scan",
      "status": "synced",
      "at": "2026-10-15T18:31:20Z",
      "note": "Found by the in-app photo scan (import 6ad11aeae5cae85798172dd5) in photo.emma.r05-office.v1; library garment file assets/garments/black-trousers-v1.jpg. App sourcePhotoId is the import's own photo id; photoId here is the camera-roll photo it came from."
    },
    {
      "libraryId": "garment.emma.sweatshirt-crewneck-grey.v1",
      "photoId": "photo.emma.r03-brooklyn-street.v1",
      "appItemIds": [
        "abc4180872712f057d2b9dae"
      ],
      "appNames": [
        "Grey Sweatshirt"
      ],
      "via": "gallery-scan",
      "status": "synced",
      "at": "2026-10-15T18:31:20Z",
      "note": "Found by the in-app photo scan (import 6ad11aeae5cae85798172dd5) in photo.emma.r03-brooklyn-street.v1; library garment file assets/garments/grey-crewneck-sweatshirt-v1.jpg. App sourcePhotoId is the import's own photo id; photoId here is the camera-roll photo it came from."
    },
    {
      "libraryId": "garment.emma.sneakers-leather-white.v1",
      "photoId": "photo.emma.r03-brooklyn-street.v1",
      "appItemIds": [
        "69757b5eac62b4a41aa0a99c"
      ],
      "appNames": [
        "White Sneakers"
      ],
      "via": "gallery-scan",
      "status": "synced",
      "at": "2026-10-15T18:31:20Z",
      "note": "Found by the in-app photo scan (import 6ad11aeae5cae85798172dd5) in photo.emma.r03-brooklyn-street.v1; library garment file assets/garments/white-leather-sneakers-v1.jpg. App sourcePhotoId is the import's own photo id; photoId here is the camera-roll photo it came from."
    },
    {
      "libraryId": "garment.emma.sweater-cable-knit-cream.v1",
      "photoId": "photo.emma.r28-couch-cozy.v1",
      "appItemIds": [
        "0835aab41a0c42c444ff708f"
      ],
      "appNames": [
        "Beige Cable Knit Sweater"
      ],
      "via": "gallery-scan",
      "status": "synced",
      "at": "2026-10-15T18:31:20Z",
      "note": "Found by the in-app photo scan (import 6ad11aeae5cae85798172dd5) in photo.emma.r28-couch-cozy.v1; library garment file assets/garments/cream-cable-knit-sweater-v1.jpg. App sourcePhotoId is the import's own photo id; photoId here is the camera-roll photo it came from."
    },
    {
      "libraryId": "garment.emma.jeans-straight-dark-wash.v1",
      "photoId": "photo.emma.r16-bookstore.v1",
      "appItemIds": [
        "b72a0c160fdac5ae04a62e68"
      ],
      "appNames": [
        "Blue Jeans"
      ],
      "via": "gallery-scan",
      "status": "synced",
      "at": "2026-10-15T18:31:21Z",
      "note": "Found by the in-app photo scan (import 6ad11aeae5cae85798172dd5) in photo.emma.r16-bookstore.v1; library garment file assets/garments/dark-wash-straight-jeans-v1.jpg. App sourcePhotoId is the import's own photo id; photoId here is the camera-roll photo it came from."
    },
    {
      "libraryId": "garment.emma.shirt-oxford-blue.v1",
      "photoId": "photo.emma.r25-cafe-laptop.v1",
      "appItemIds": [
        "38712360109a794cb5a6fcf0"
      ],
      "appNames": [
        "Blue Button-down shirt"
      ],
      "via": "gallery-scan",
      "status": "synced",
      "at": "2026-10-15T18:31:21Z",
      "note": "Found by the in-app photo scan (import 6ad11aeae5cae85798172dd5) in photo.emma.r25-cafe-laptop.v1; library garment file assets/garments/blue-oxford-shirt-v1.jpg. App sourcePhotoId is the import's own photo id; photoId here is the camera-roll photo it came from."
    },
    {
      "libraryId": "garment.emma.tee-long-sleeve-striped.v1",
      "photoId": "photo.emma.r06-farmers-market.v1",
      "appItemIds": [
        "c5c1c0bab1dbdf5625d5a5fa"
      ],
      "appNames": [
        "White Striped Long Sleeve T-shirt"
      ],
      "via": "gallery-scan",
      "status": "synced",
      "at": "2026-10-15T18:31:21Z",
      "note": "Found by the in-app photo scan (import 6ad11aeae5cae85798172dd5) in photo.emma.r06-farmers-market.v1; library garment file assets/garments/striped-long-sleeve-tee-v1.jpg. App sourcePhotoId is the import's own photo id; photoId here is the camera-roll photo it came from."
    },
    {
      "libraryId": "garment.emma.jacket-leather-black.v1",
      "photoId": "photo.emma.r07-rooftop-golden-hour.v1",
      "appItemIds": [
        "b98bdc2b8f163cacfe28b68f"
      ],
      "appNames": [
        "Black Leather Biker Jacket"
      ],
      "via": "gallery-scan",
      "status": "synced",
      "at": "2026-10-15T18:31:21Z",
      "note": "Found by the in-app photo scan (import 6ad11aeae5cae85798172dd5) in photo.emma.r07-rooftop-golden-hour.v1; library garment file assets/garments/black-leather-jacket-v1.jpg. App sourcePhotoId is the import's own photo id; photoId here is the camera-roll photo it came from."
    },
    {
      "libraryId": "garment.emma.shirt-linen-white.v1",
      "photoId": "photo.emma.r08-beach-day.v1",
      "appItemIds": [
        "b23d0e5e95784d76e2075ae8"
      ],
      "appNames": [
        "White Button-down Shirt"
      ],
      "via": "gallery-scan",
      "status": "synced",
      "at": "2026-10-15T18:31:21Z",
      "note": "Found by the in-app photo scan (import 6ad11aeae5cae85798172dd5) in photo.emma.r08-beach-day.v1; library garment file assets/garments/white-linen-shirt-v1.jpg. App sourcePhotoId is the import's own photo id; photoId here is the camera-roll photo it came from."
    },
    {
      "libraryId": "garment.emma.tank-ribbed-black.v1",
      "photoId": "photo.emma.r08-beach-day.v1",
      "appItemIds": [
        "7559e723948d8a32593a780c"
      ],
      "appNames": [
        "Black Tank Top"
      ],
      "via": "gallery-scan",
      "status": "synced",
      "at": "2026-10-15T18:31:21Z",
      "note": "Found by the in-app photo scan (import 6ad11aeae5cae85798172dd5) in photo.emma.r08-beach-day.v1; library garment file assets/garments/black-ribbed-tank-v1.jpg. App sourcePhotoId is the import's own photo id; photoId here is the camera-roll photo it came from."
    },
    {
      "libraryId": "garment.emma.shorts-denim-cutoff.v1",
      "photoId": "photo.emma.r08-beach-day.v1",
      "appItemIds": [
        "24b86bdd84a5c6ec656189bd"
      ],
      "appNames": [
        "Blue Denim Shorts"
      ],
      "via": "gallery-scan",
      "status": "synced",
      "at": "2026-10-15T18:31:21Z",
      "note": "Found by the in-app photo scan (import 6ad11aeae5cae85798172dd5) in photo.emma.r08-beach-day.v1; library garment file assets/garments/denim-cutoff-shorts-v1.jpg. App sourcePhotoId is the import's own photo id; photoId here is the camera-roll photo it came from."
    },
    {
      "libraryId": "garment.emma.sandals-tan.v1",
      "photoId": "photo.emma.r08-beach-day.v1",
      "appItemIds": [
        "abd4e799db8603c826f8817c"
      ],
      "appNames": [
        "Brown Slide Sandals"
      ],
      "via": "gallery-scan",
      "status": "synced",